<?xml version="1.0" encoding="UTF-8"?>
<rechnungsliste xsi:noNamespaceSchemaLocation="Elektronikrechnungen.xsd" xmlns:xsi="http://www.w3.org/2001/XMLSchema-instance">
	
	<rechnung id="001">
		<kaufdatum>2022-04-28</kaufdatum>
		<kaufliste>
			<gegenstand>
				<bezeichnung>LOGOTECH T335 Headset Schwarz</bezeichnung>
				<menge>1</menge>
				<einzelpreis>
					<betrag>39.99</betrag>
					<waehrung>euro</waehrung>
				</einzelpreis>
			</gegenstand>
		</kaufliste>
		<haendler>
			<name>Jupiter Elektrohandel</name>
			<ort>Chemnitz</ort>
			<plz>09111</plz>
			<strasse>Bahnhofstrasse</strasse>
			<hausnummer>11</hausnummer>
		</haendler>
	</rechnung>
	
	<rechnung id="002">
		<kaufdatum>2022-05-12</kaufdatum>
		<kaufliste>
			<gegenstand>
				<bezeichnung>Fastlink Maus M290 Anthrazit</bezeichnung>
				<menge>1</menge>
				<einzelpreis>
					<betrag>11.50</betrag>
					<waehrung>euro</waehrung>
				</einzelpreis>
			</gegenstand>
			<gegenstand>
				<bezeichnung>Fastlink Tastatur T290 Grau</bezeichnung>
				<menge>1</menge>
				<einzelpreis>
					<betrag>19.99</betrag>
					<waehrung>euro</waehrung>
				</einzelpreis>
			</gegenstand>
		</kaufliste>
		<haendler>
			<name>MegaMarkt</name>
			<ort>Leipzig</ort>
			<plz>04103</plz>
			<strasse>Marktplatz</strasse>
			<hausnummer>60</hausnummer>
		</haendler>
	</rechnung>
	
	<rechnung id="003">
		<kaufdatum>2022-03-25</kaufdatum>
		<kaufliste>
			<gegenstand>
				<bezeichnung>GL F2323 24'' LED Monitor</bezeichnung>
				<menge>1</menge>
				<einzelpreis>
					<betrag>105.50</betrag>
					<waehrung>euro</waehrung>
				</einzelpreis>
			</gegenstand>
			<gegenstand>
				<bezeichnung>HDMI Kabel 2 Meter</bezeichnung>
				<menge>3</menge>
				<einzelpreis>
					<betrag>2.99</betrag>
					<waehrung>euro</waehrung>
				</einzelpreis>
			</gegenstand>
		</kaufliste>
		<haendler>
			<name>MegaMarkt</name>
			<ort>Leipzig</ort>
			<plz>04103</plz>
			<strasse>Marktplatz</strasse>
			<hausnummer>60</hausnummer>
		</haendler>
	</rechnung>


</rechnungsliste>